{
  "STORE_NAME": "BOUTIQUE_A_REMPLACER",
  "LEGAL_NAME": "ENTREPRISE_A_REMPLACER",
  "LEGAL_FORM": "FORME_JURIDIQUE_A_REMPLACER",
  "SHARE_CAPITAL": "CAPITAL_A_REMPLACER_OU_MENTION_A_SUPPRIMER",
  "REGISTER_ID": "SIREN_SIRET_A_REMPLACER",
  "REGISTER_CITY": "VILLE_IMMATRICULATION_A_REMPLACER",
  "VAT_ID": "TVA_A_REMPLACER_OU_MENTION_A_SUPPRIMER",
  "REGISTERED_ADDRESS": "ADRESSE_SIEGE_A_REMPLACER",
  "RETURN_ADDRESS": "ADRESSE_RETOUR_OPERATIONNELLE_A_REMPLACER",
  "SUPPORT_EMAIL": "a-remplacer@example.invalid",
  "SUPPORT_PHONE": "TELEPHONE_A_REMPLACER",
  "SUPPORT_HOURS": "HORAIRES_A_REMPLACER",
  "RESPONSE_TIME": "DELAI_REPONSE_REEL_A_REMPLACER",
  "WEBSITE_URL": "https://example.invalid",
  "HOST_NAME": "HEBERGEUR_A_REMPLACER",
  "HOST_ADDRESS": "ADRESSE_HEBERGEUR_A_REMPLACER",
  "HOST_PHONE": "TELEPHONE_HEBERGEUR_A_REMPLACER",
  "PUBLICATION_DIRECTOR": "DIRECTEUR_PUBLICATION_A_REMPLACER",
  "SELLING_COUNTRIES": "ZONES_REELLEMENT_DESSERVIES_A_REMPLACER",
  "CURRENCY": "EUR",
  "PRICES_INCLUDE_TAX": "CONVENTION_TTC_TVA_A_REMPLACER",
  "PAYMENT_METHODS": "MOYENS_REELLEMENT_ACTIFS_A_REMPLACER",
  "PAYMENT_PROVIDER": "PRESTATAIRE_PAIEMENT_A_REMPLACER",
  "ORDER_CUTOFF": "HEURE_LIMITE_ET_FUSEAU_A_REMPLACER",
  "HANDLING_TIME": "DELAI_TRAITEMENT_A_REMPLACER",
  "TRANSIT_TIME": "DELAI_TRANSIT_A_REMPLACER",
  "TOTAL_DELIVERY_TIME": "DELAI_TOTAL_A_REMPLACER",
  "BUSINESS_DAYS": "JOURS_OUVRES_A_REMPLACER",
  "CARRIERS": "TRANSPORTEURS_REELS_A_REMPLACER",
  "SHIPPING_PRICE_RULE": "REGLE_FRAIS_LIVRAISON_A_REMPLACER",
  "TRACKING_URL": "https://example.invalid/suivi-a-remplacer",
  "WITHDRAWAL_DAYS": 14,
  "COMMERCIAL_RETURN_DAYS": 0,
  "RETURN_COST_CHANGE_OF_MIND": "RESPONSABLE_COUT_RETOUR_AVIS_A_REMPLACER",
  "RETURN_COST_DEFECT": "PRISE_EN_CHARGE_DEFAUT_A_REMPLACER",
  "RETURN_METHOD": "PROCESSUS_ECHANGE_OU_REMBOURSEMENT_A_REMPLACER",
  "NON_RETURNABLE_CATEGORIES": "EXCEPTIONS_LEGALES_A_VALIDER_OU_AUCUNE",
  "REFUND_PROCESSING_INFO": "PROCESSUS_ET_DELAIS_REELS_A_REMPLACER",
  "MEDIATOR_NAME": "MEDIATEUR_EFFECTIVEMENT_CHOISI_A_REMPLACER",
  "MEDIATOR_ADDRESS": "ADRESSE_MEDIATEUR_A_REMPLACER",
  "MEDIATOR_URL": "https://example.invalid/mediateur-a-remplacer",
  "PRIVACY_CONTACT": "vie-privee-a-remplacer@example.invalid",
  "DPO_CONTACT": "DPO_A_REMPLACER_OU_MENTION_NON_APPLICABLE",
  "DATA_HOSTING_COUNTRIES": "PAYS_TRAITEMENT_A_REMPLACER",
  "DATA_PROCESSORS": "PRESTATAIRES_REELS_A_REMPLACER",
  "TRANSFER_SAFEGUARDS": "GARANTIES_TRANSFERT_A_REMPLACER",
  "RETENTION_ORDER": "DUREE_COMMANDES_A_REMPLACER",
  "RETENTION_DELIVERY": "DUREE_LIVRAISON_A_REMPLACER",
  "RETENTION_SUPPORT": "DUREE_SUPPORT_A_REMPLACER",
  "RETENTION_ACCOUNTING": "DUREE_COMPTABLE_A_VALIDER",
  "RETENTION_SECURITY": "DUREE_SECURITE_A_REMPLACER",
  "RETENTION_MARKETING": "DUREE_MARKETING_CLIENTS_A_REMPLACER",
  "RETENTION_PROSPECT": "DUREE_PROSPECTS_A_REMPLACER",
  "RETENTION_ANALYTICS": "DUREE_ANALYTICS_A_REMPLACER",
  "RETENTION_ADS": "DUREE_PUBLICITE_A_REMPLACER",
  "ESSENTIAL_COOKIES": "COOKIES_ESSENTIELS_ISSUS_DU_SCAN",
  "ESSENTIAL_DURATION": "DUREE_ESSENTIELS_A_REMPLACER",
  "PREFERENCE_COOKIES": "COOKIES_PREFERENCE_ISSUS_DU_SCAN",
  "PREFERENCE_DURATION": "DUREE_PREFERENCE_A_REMPLACER",
  "ANALYTICS_COOKIES": "COOKIES_ANALYTICS_ISSUS_DU_SCAN",
  "ANALYTICS_DURATION": "DUREE_ANALYTICS_A_REMPLACER",
  "ADS_COOKIES": "COOKIES_ADS_ISSUS_DU_SCAN",
  "ADS_DURATION": "DUREE_ADS_A_REMPLACER",
  "BILLING_PROCESS": "PROCESSUS_FACTURATION_A_REMPLACER",
  "COOKIE_SETTINGS_URL": "https://example.invalid/parametres-cookies-a-remplacer",
  "PRIVACY_UPDATED_AT": "DATE_A_REMPLACER",
  "TERMS_UPDATED_AT": "DATE_A_REMPLACER"
}
